{
  "schema_version": "fact_extraction_output_v1",
  "task_type": "receivable_review",
  "raw_evidence": [
    {
      "source": "user_text",
      "text": "这是一个印尼海外项目，应收账款逾期 42 天，客户说还没完成验收，所以暂时不付款。"
    }
  ],
  "base_facts": {
    "project.region_type": {
      "value": "overseas",
      "source": "user_text",
      "evidence_text": "印尼海外项目",
      "confidence": 0.95
    },
    "project.country": {
      "value": "Indonesia",
      "source": "user_text",
      "evidence_text": "印尼",
      "confidence": 0.9
    },
    "receivable.overdue_days": {
      "value": 42,
      "source": "user_text",
      "evidence_text": "逾期 42 天",
      "confidence": 0.98
    },
    "receivable.has_dispute": {
      "value": true,
      "source": "user_text",
      "evidence_text": "客户说还没完成验收，所以暂时不付款",
      "confidence": 0.88
    },
    "acceptance.completed_status": {
      "value": "not_completed",
      "source": "user_text",
      "evidence_text": "还没完成验收",
      "confidence": 0.92
    }
  },
  "derived_facts": {},
  "unmapped_facts": [],
  "field_change_requests": [],
  "decision_state": {
    "state": "ready_for_rule_check",
    "missing_facts": [],
    "blocked_by": [],
    "next_action": "run_rule_engine"
  }
}

